{
  "bundle_id": "AB-ESC-001",
  "target": "10.0.0.55",
  "tool": "log_analyzer",
  "tool_class": "ANALYSIS",
  "parameters": {
    "source": "simulated_log.jsonl"
  },
  "scope_tags": [
    "LAB"
  ],
  "time_bound": "2026-12-31T00:00:00Z",
  "data_handling": "INTERNAL",
  "expected_results": {
    "findings": []
  },
  "evidence_plan": {
    "evidence_level": "FULL",
    "artifacts": [
      "analysis_report"
    ]
  }
}