{
  "bundle_id": "AB-BLOCK-001",
  "target": "prod.realworld.tld",
  "tool": "port_scan_sim",
  "tool_class": "SCAN",
  "parameters": {
    "ports": [
      22,
      80,
      443
    ]
  },
  "scope_tags": [
    "OUT_OF_SCOPE"
  ],
  "time_bound": "2026-12-31T00:00:00Z",
  "data_handling": "SENSITIVE",
  "expected_results": {
    "open_ports": []
  },
  "evidence_plan": {
    "evidence_level": "FULL",
    "artifacts": [
      "stdout_log",
      "audit_snapshot"
    ]
  }
}